{
  "schemaVersion": 1,
  "surface": "wdu.cinematic-timeline",
  "project": "timeline-fixture-portrait-required",
  "modeInput": "WDU_DETERMINISTIC=1",
  "clock": "injected",
  "range": [0, 1],
  "tracks": [
    { "id": "dom-hero-opacity", "kind": "dom", "property": "dom.hero.opacity", "owner": "dom-hero-opacity", "keyframes": [{ "progress": 0, "value": 0 }, { "progress": 1, "value": 1 }] },
    { "id": "camera-hero-z", "kind": "camera", "property": "camera.hero.z", "owner": "camera-hero-z", "keyframes": [{ "progress": 0, "value": 6 }, { "progress": 1, "value": 2 }] },
    { "id": "scene-hero-rotation", "kind": "scene", "property": "scene.hero.rotationY", "owner": "scene-hero-rotation", "keyframes": [{ "progress": 0, "value": 0 }, { "progress": 1, "value": 1 }] },
    { "id": "material-hero-emissive", "kind": "material", "property": "material.hero.emissive", "owner": "material-hero-emissive", "keyframes": [{ "progress": 0, "value": 0 }, { "progress": 1, "value": 1 }] },
    { "id": "sound-ambient-gain", "kind": "sound", "property": "sound.ambient.gain", "owner": "sound-ambient-gain", "keyframes": [{ "progress": 0, "value": 0 }, { "progress": 1, "value": 1 }] },
    { "id": "loading-bucket-progress", "kind": "loading", "property": "loading.bucket.progress", "owner": "loading-bucket-progress", "keyframes": [{ "progress": 0, "value": 0 }, { "progress": 1, "value": 1 }] }
  ],
  "checkpoints": [
    { "id": "timeline-0", "progress": 0 },
    { "id": "timeline-100", "progress": 1 }
  ],
  "requiresPortrait": true
}
