{
  "schemaVersion": 1,
  "surface": "wdu.cinematic-timeline",
  "project": "next-r3f-cinematic",
  "modeInput": "WDU_DETERMINISTIC=1",
  "clock": "injected",
  "range": [0, 1],
  "tracks": [
    {
      "id": "dom-hero-opacity",
      "kind": "dom",
      "property": "dom.hero.opacity",
      "owner": "dom-hero-opacity",
      "keyframes": [
        { "progress": 0, "value": 0 },
        { "progress": 0.45, "value": 1 },
        { "progress": 1, "value": 1 }
      ]
    },
    {
      "id": "camera-hero-z",
      "kind": "camera",
      "property": "camera.hero.z",
      "owner": "camera-hero-z",
      "keyframes": [
        { "progress": 0, "value": 4.6 },
        { "progress": 0.5, "value": 4.95 },
        { "progress": 1, "value": 5.3 }
      ]
    },
    {
      "id": "scene-hero-rotation",
      "kind": "scene",
      "property": "scene.hero.rotationY",
      "owner": "scene-hero-rotation",
      "keyframes": [
        { "progress": 0, "value": 0 },
        { "progress": 1, "value": 0.85 }
      ]
    },
    {
      "id": "material-hero-emissive",
      "kind": "material",
      "property": "material.hero.emissive",
      "owner": "material-hero-emissive",
      "keyframes": [
        { "progress": 0, "value": 0 },
        { "progress": 0.6, "value": 0.4 },
        { "progress": 1, "value": 0.75 }
      ]
    },
    {
      "id": "sound-ambient-gain",
      "kind": "sound",
      "property": "sound.ambient.gain",
      "owner": "sound-ambient-gain",
      "keyframes": [
        { "progress": 0, "value": 0 },
        { "progress": 0.2, "value": 0 },
        { "progress": 0.7, "value": 1 },
        { "progress": 1, "value": 1 }
      ]
    },
    {
      "id": "loading-bucket-progress",
      "kind": "loading",
      "property": "loading.bucket.progress",
      "owner": "loading-bucket-progress",
      "keyframes": [
        { "progress": 0, "value": 0 },
        { "progress": 0.35, "value": 1 },
        { "progress": 1, "value": 1 }
      ]
    }
  ],
  "checkpoints": [
    { "id": "timeline-0", "progress": 0 },
    { "id": "timeline-50", "progress": 0.5 },
    { "id": "timeline-100", "progress": 1 }
  ],
  "portrait": {
    "tracks": [
      {
        "id": "dom-hero-opacity",
        "kind": "dom",
        "property": "dom.hero.opacity",
        "owner": "dom-hero-opacity",
        "keyframes": [
          { "progress": 0, "value": 0 },
          { "progress": 0.45, "value": 1 },
          { "progress": 1, "value": 1 }
        ]
      },
      {
        "id": "camera-hero-z-portrait",
        "kind": "camera",
        "property": "camera.hero.z",
        "owner": "camera-hero-z-portrait",
        "keyframes": [
          { "progress": 0, "value": 5.8 },
          { "progress": 0.5, "value": 6.2 },
          { "progress": 1, "value": 6.6 }
        ]
      },
      {
        "id": "scene-hero-rotation",
        "kind": "scene",
        "property": "scene.hero.rotationY",
        "owner": "scene-hero-rotation",
        "keyframes": [
          { "progress": 0, "value": 0 },
          { "progress": 1, "value": 0.6 }
        ]
      },
      {
        "id": "material-hero-emissive",
        "kind": "material",
        "property": "material.hero.emissive",
        "owner": "material-hero-emissive",
        "keyframes": [
          { "progress": 0, "value": 0 },
          { "progress": 0.6, "value": 0.35 },
          { "progress": 1, "value": 0.6 }
        ]
      },
      {
        "id": "sound-ambient-gain",
        "kind": "sound",
        "property": "sound.ambient.gain",
        "owner": "sound-ambient-gain",
        "keyframes": [
          { "progress": 0, "value": 0 },
          { "progress": 0.2, "value": 0 },
          { "progress": 0.7, "value": 0.85 },
          { "progress": 1, "value": 0.85 }
        ]
      },
      {
        "id": "loading-bucket-progress",
        "kind": "loading",
        "property": "loading.bucket.progress",
        "owner": "loading-bucket-progress",
        "keyframes": [
          { "progress": 0, "value": 0 },
          { "progress": 0.35, "value": 1 },
          { "progress": 1, "value": 1 }
        ]
      }
    ],
    "checkpoints": [
      { "id": "timeline-0", "progress": 0 },
      { "id": "timeline-50", "progress": 0.5 },
      { "id": "timeline-100", "progress": 1 }
    ]
  },
  "requiresPortrait": true
}
